1.
mysql> use hari;
Database changed
mysql> create table hulk(name char(20),age int,score int);
Query OK, 0 rows affected (1.03 sec)

mysql> desc hulk;
+-------+----------+------+-----+---------+-------+
| Field | Type     | Null | Key | Default | Extra |
+-------+----------+------+-----+---------+-------+
| name  | char(20) | YES  |     | NULL    |       |
| age   | int      | YES  |     | NULL    |       |
| score | int      | YES  |     | NULL    |       |
+-------+----------+------+-----+---------+-------+
3 rows in set (0.04 sec)

mysql> select*from hulk;
+------+------+-------+
| name | age  | score |
+------+------+-------+
| raj  |   26 |   120 |
+------+------+-------+
1 row in set (0.02 sec)

2.


mysql> insert into hulk(name,age,score)values('ram',26,120),('charan',24,111),('ravan',22,150);
Query OK, 3 rows affected (0.06 sec)
Records: 3  Duplicates: 0  Warnings: 0

mysql> select*from hulk;
+--------+------+-------+
| name   | age  | score |
+--------+------+-------+
| raj    |   26 |   120 |
| ram    |   26 |   120 |
| charan |   24 |   111 |
| ravan  |   22 |   150 |
+--------+------+-------+
4 rows in set (0.00 sec)

3.


mysql> insert into hulk(name,age,score)values('ram',26,120),('charan',24,111),('ravan',22,150);
Query OK, 3 rows affected (0.06 sec)
Records: 3  Duplicates: 0  Warnings: 0

mysql> select*from hulk;
+--------+------+-------+
| name   | age  | score |
+--------+------+-------+
| raj    |   26 |   120 |
| ram    |   26 |   120 |
| charan |   24 |   111 |
| ravan  |   22 |   150 |
+--------+------+-------+
4 rows in set (0.00 sec)

mysql> delete hulk raj;
ERROR 1064 (42000): You have an error in your SQL syntax; check the manual that corresponds to your MySQL server version for the right syntax to use near 'raj' at line 1
mysql> delete from hulk where name ='ravan';
Query OK, 1 row affected (0.06 sec)

mysql> select*from hulk;
+--------+------+-------+
| name   | age  | score |
+--------+------+-------+
| raj    |   26 |   120 |
| ram    |   26 |   120 |
| charan |   24 |   111 |
+--------+------+-------+
3 rows in set (0.00 sec)

4.

mysql> update hulk set age=30 where name='raj';
Query OK, 1 row affected (0.16 sec)
Rows matched: 1  Changed: 1  Warnings: 0

mysql> select*from hulk;
+--------+------+-------+
| name   | age  | score |
+--------+------+-------+
| raj    |   30 |   120 |
| ram    |   26 |   120 |
| charan |   24 |   111 |
+--------+------+-------+
3 rows in set (0.00 sec)

5.


mysql> delete from hulk where name='ram';
Query OK, 1 row affected (0.10 sec)

mysql> select*from hulk;
+--------+------+-------+
| name   | age  | score |
+--------+------+-------+
| raj    |   30 |   120 |
| charan |   24 |   111 |
+--------+------+-------+
2 rows in set (0.00 sec)

6.


mysql> alter table hulk add strikerate float;
Query OK, 0 rows affected (0.24 sec)
Records: 0  Duplicates: 0  Warnings: 0

mysql> select*from hulk;
+--------+------+-------+------------+
| name   | age  | score | strikerate |
+--------+------+-------+------------+
| raj    |   30 |   120 |       NULL |
| charan |   24 |   111 |       NULL |
+--------+------+-------+------------+
2 rows in set (0.00 sec)

7.


mysql> select name,age from hulk;
+--------+------+
| name   | age  |
+--------+------+
| raj    |   30 |
| charan |   24 |
+--------+------+
2 rows in set (0.00 sec)

8.

mysql> alter table hulk rename to fullname;
Query OK, 0 rows affected (0.14 sec)

mysql> select*from hulk;
ERROR 1146 (42S02): Table 'hari.hulk' doesn't exist
mysql> desc hulk;
ERROR 1146 (42S02): Table 'hari.hulk' doesn't exist
mysql> desc fullname;
+------------+----------+------+-----+---------+-------+
| Field      | Type     | Null | Key | Default | Extra |
+------------+----------+------+-----+---------+-------+
| name       | char(20) | YES  |     | NULL    |       |
| age        | int      | YES  |     | NULL    |       |
| score      | int      | YES  |     | NULL    |       |
| strikerate | float    | YES  |     | NULL    |       |
+------------+----------+------+-----+---------+-------+
4 rows in set (0.01 sec)

9.

mysql> delete from fullname;
Query OK, 2 rows affected (0.05 sec)
mysql> select*from fullname;
Empty set (0.00 sec)

